{
  "data": {
    "aggregateId": "019fe700-0000-7000-8000-000000000001",
    "aggregateType": "data-batch",
    "aggregateVersion": 4,
    "batch": {
      "aggregateVersion": 4,
      "batchId": "019fe700-0000-7000-8000-000000000001",
      "cutoffAt": "2026-08-10T00:00:00Z",
      "effectiveAt": "2026-08-09T00:00:00Z",
      "evaluatedAt": "2026-08-10T00:00:00Z",
      "lineageId": "019fe700-0000-7000-8000-000000000002",
      "manifestDigest": "sha256:aaaaaaaaaaaaaaaaaaaaaaaaaaaaaaaaaaaaaaaaaaaaaaaaaaaaaaaaaaaaaaaa",
      "observationWindow": {"endAt": "2026-08-10T00:00:00Z", "startAt": "2026-08-09T00:00:00Z"},
      "publishedAt": "2026-08-10T00:05:00Z",
      "qualityGateDigest": "sha256:bbbbbbbbbbbbbbbbbbbbbbbbbbbbbbbbbbbbbbbbbbbbbbbbbbbbbbbbbbbbbbbb",
      "qualityGateVersion": "QG-1.0.0",
      "qualityMetricDecisionProfileDigest": "sha256:cccccccccccccccccccccccccccccccccccccccccccccccccccccccccccccccc",
      "qualityMetricDecisionProfileVersion": "QMDP-1.0.0",
      "sourceId": "SRC-P0-STUDENT-001",
      "sourceSchemaDigest": "sha256:dddddddddddddddddddddddddddddddddddddddddddddddddddddddddddddddd",
      "sourceSchemaVersion": "SIS-1.0.0",
      "sourceVersion": 20260810,
      "status": "published",
      "supersedesBatchId": null,
      "watermark": "src-p0-student-001@2026-08-10"
    },
    "causationId": "019fe700-0000-7000-8000-000000000011",
    "contractVersion": "PIC-1.0.0",
    "correlationId": "019fe700-0000-7000-8000-000000000013",
    "eventId": "019fe700-0000-7000-8000-000000000014",
    "occurredAt": "2026-08-10T00:05:00Z",
    "producer": "ingestion-quality",
    "qualitySnapshot": {
      "aggregateVersion": 3,
      "approvalRef": "AUTH-2026-08-08-001",
      "assessedBatchStatus": "quality-passed",
      "batchId": "019fe700-0000-7000-8000-000000000001",
      "canonicalizationProfile": "SCHOLARSENSE-CANONICAL-JSON-1.0.0",
      "cutoffAt": "2026-08-10T00:00:00Z",
      "effectiveAt": "2026-08-09T00:00:00Z",
      "evaluatedAt": "2026-08-10T00:00:00Z",
      "immutableHash": "sha256:eeeeeeeeeeeeeeeeeeeeeeeeeeeeeeeeeeeeeeeeeeeeeeeeeeeeeeeeeeeeeeee",
      "impactScopeCodes": ["PRIMARY_KEY_COMPLETENESS"],
      "lineageId": "019fe700-0000-7000-8000-000000000002",
      "manifestDigest": "sha256:aaaaaaaaaaaaaaaaaaaaaaaaaaaaaaaaaaaaaaaaaaaaaaaaaaaaaaaaaaaaaaaa",
      "metricResults": [{"applicable": true, "boundary": "inclusive", "denominator": 1000, "formulaId": "QMDP-1.0.0/primary-key-completeness", "formulaVersion": "1.0.0", "metricId": "PRIMARY_KEY_COMPLETENESS", "numerator": 1000, "operator": ">=", "reasonCode": null, "result": "passed", "thresholdDenominator": 1000, "thresholdNumerator": 995, "unit": "basis-point", "valueBasisPoints": 10000}],
      "observationWindow": {"endAt": "2026-08-10T00:00:00Z", "startAt": "2026-08-09T00:00:00Z"},
      "overallResult": "quality-passed",
      "qualityGateDigest": "sha256:bbbbbbbbbbbbbbbbbbbbbbbbbbbbbbbbbbbbbbbbbbbbbbbbbbbbbbbbbbbbbbbb",
      "qualityGateVersion": "QG-1.0.0",
      "qualityMetricDecisionProfileDigest": "sha256:cccccccccccccccccccccccccccccccccccccccccccccccccccccccccccccccc",
      "qualityMetricDecisionProfileVersion": "QMDP-1.0.0",
      "retentionScheduleVersion": "RS-1.0.0",
      "snapshotId": "019fe700-0000-7000-8000-000000000003",
      "sourceId": "SRC-P0-STUDENT-001",
      "sourceOwnerRef": "SRC-P0-STUDENT-001",
      "sourceSchemaDigest": "sha256:dddddddddddddddddddddddddddddddddddddddddddddddddddddddddddddddd",
      "sourceSchemaVersion": "SIS-1.0.0",
      "supersedesSnapshotId": null,
      "traceId": "00112233445566778899aabbccddeeff",
      "watermark": "src-p0-student-001@2026-08-10"
    },
    "runtimeEvidenceClaim": "none",
    "schemaVersion": "DATA-BATCH-PUBLISHED-1.0.0",
    "traceId": "ffeeddccbbaa99887766554433221100"
  },
  "datacontenttype": "application/json",
  "id": "019fe700-0000-7000-8000-000000000014",
  "source": "urn:scholarsense:ingestion-quality",
  "specversion": "1.0",
  "subject": "data-batch/019fe700-0000-7000-8000-000000000001",
  "time": "2026-08-10T00:05:00Z",
  "traceparent": "00-ffeeddccbbaa99887766554433221100-ffeeddccbbaa9988-01",
  "type": "scholarsense.ingestion-quality.data-batch.published.v1"
}
