{
  "specversion": "1.0",
  "id": "019d2c7d-4000-7000-8000-000000000301",
  "source": "urn:scholarsense:ingestion-quality",
  "type": "scholarsense.ingestion-quality.quality-snapshot.deletion-result.v1",
  "subject": "quality-snapshot/019d2c7d-4000-7000-8000-000000000120",
  "time": "2026-08-10T00:06:00Z",
  "datacontenttype": "application/json",
  "traceparent": "00-cccccccccccccccccccccccccccccccc-dddddddddddddddd-01",
  "data": {
    "resultContractVersion": "QUALITY-SNAPSHOT-DELETION-RESULT-1.0.0",
    "contractVersion": "PIC-1.0.0",
    "correlationId": "019d2c7d-4000-7000-8000-000000000300",
    "causationId": "019d2c7d-4000-7000-8000-000000000290",
    "eventId": "019d2c7d-4000-7000-8000-000000000301",
    "aggregateType": "quality-snapshot-deletion-execution",
    "aggregateId": "019d2c7d-4000-7000-8000-000000000300",
    "aggregateVersion": 1,
    "executionId": "019d2c7d-4000-7000-8000-000000000300",
    "supersedesResultId": null,
    "producer": "ingestion-quality-retention-executor",
    "occurredAt": "2026-08-10T00:06:00Z",
    "traceId": "cccccccccccccccccccccccccccccccc",
    "result": "partial",
    "retentionPolicyVersion": "QUALITY-SNAPSHOT-RETENTION-1.0.0",
    "retentionScheduleVersion": "RS-1.0.0",
    "scope": {
      "objectType": "QualitySnapshot",
      "snapshotId": "019d2c7d-4000-7000-8000-000000000120",
      "sourceId": "SRC-P0-STUDENT-001",
      "snapshotAggregateVersion": 11,
      "evaluatedAt": "2024-08-09T00:00:00Z",
      "retentionDueAt": "2026-08-09T00:00:00Z",
      "snapshotImmutableHash": "sha256:2222222222222222222222222222222222222222222222222222222222222222",
      "scopeDigest": "sha256:ab97df0cd48644d4129f66d99a8606e326b87c0cd5020f61b5b26e90abf637a0"
    },
    "guards": {
      "trustedTime": {
        "status": "available",
        "observedAt": "2026-08-10T00:05:00Z"
      },
      "legalHold": {
        "status": "clear",
        "checkedScopeDigest": "sha256:ab97df0cd48644d4129f66d99a8606e326b87c0cd5020f61b5b26e90abf637a0",
        "matchedCount": 0,
        "matchedScopeDigests": [],
        "checkedAt": "2026-08-10T00:05:00Z"
      },
      "consumerRegistry": {
        "status": "available",
        "registryVersion": "QUALITY-SNAPSHOT-CONSUMER-REGISTRY-1.0.0",
        "registryDigest": "sha256:bb48cbb73b60c2490b8abc17bcd0955d2d2c28da3339ab697c3500690d7c2247",
        "members": [
          {
            "consumerId": "clue-care",
            "registryMembership": "required-for-snapshot",
            "lifecycleStatus": "active"
          }
        ],
        "conformanceAnchorId": "active-clue-care-consumer-set",
        "checkedAt": "2026-08-10T00:05:00Z",
        "authorityEvidence": {
          "provider": "quality-snapshot-consumer-registry-conformance-anchor",
          "evidenceRef": "contract://quality-snapshot-retention/consumer-registry/active-clue-care-consumer-set",
          "scopeDigest": "sha256:ab97df0cd48644d4129f66d99a8606e326b87c0cd5020f61b5b26e90abf637a0",
          "registryVersion": "QUALITY-SNAPSHOT-CONSUMER-REGISTRY-1.0.0",
          "registryDigest": "sha256:bb48cbb73b60c2490b8abc17bcd0955d2d2c28da3339ab697c3500690d7c2247",
          "membersDigest": "sha256:c3cb72b301ee258c0b563c99be2504be6d9e3e58e0ce7beed5f2430d65fb9af5",
          "checkedAt": "2026-08-10T00:05:00Z",
          "verificationStatus": "contract-conformance",
          "runtimeEvidenceClaim": "none"
        }
      },
      "consumerWatermarksCheckedAt": "2026-08-10T00:05:00Z",
      "consumerWatermarks": [
        {
          "consumerId": "clue-care",
          "registryMembership": "required-for-snapshot",
          "lifecycleStatus": "active",
          "watermarkStatus": "confirmed",
          "requiredAggregateVersion": 11,
          "confirmedAggregateVersion": 11,
          "transportAck": "acked",
          "inboxAck": "acked",
          "evidenceCopyAck": "copied",
          "attestation": {
            "kind": "evidence-copy",
            "snapshotId": "019d2c7d-4000-7000-8000-000000000120",
            "snapshotImmutableHash": "sha256:2222222222222222222222222222222222222222222222222222222222222222",
            "requiredAggregateVersion": 11,
            "consumerId": "clue-care",
            "registryVersion": "QUALITY-SNAPSHOT-CONSUMER-REGISTRY-1.0.0",
            "registryDigest": "sha256:bb48cbb73b60c2490b8abc17bcd0955d2d2c28da3339ab697c3500690d7c2247",
            "scopeDigest": "sha256:ab97df0cd48644d4129f66d99a8606e326b87c0cd5020f61b5b26e90abf637a0",
            "attestedAt": "2026-08-10T00:03:00Z"
          }
        }
      ]
    },
    "ownerLocalResults": {
      "onlineSnapshot": {
        "status": "deleted",
        "selectedCount": 1,
        "deletedCount": 1,
        "remainingCount": 0,
        "evidenceDigest": "sha256:aaaaaaaaaaaaaaaaaaaaaaaaaaaaaaaaaaaaaaaaaaaaaaaaaaaaaaaaaaaaaaaa",
        "errorCode": null,
        "transactionId": "019d2c7d-4000-7000-8000-000000000350",
        "transactionEvidenceDigest": "sha256:16b2ba386fdb547073b14b729d1a48020a67ee9c7e49212381a4eeaff3cc0d94"
      },
      "onlineMetrics": {
        "status": "deleted",
        "selectedCount": 12,
        "deletedCount": 12,
        "remainingCount": 0,
        "evidenceDigest": "sha256:bbbbbbbbbbbbbbbbbbbbbbbbbbbbbbbbbbbbbbbbbbbbbbbbbbbbbbbbbbbbbbbb",
        "errorCode": null,
        "transactionId": "019d2c7d-4000-7000-8000-000000000350",
        "transactionEvidenceDigest": "sha256:16b2ba386fdb547073b14b729d1a48020a67ee9c7e49212381a4eeaff3cc0d94"
      },
      "readModels": {
        "status": "deleted",
        "selectedCount": 2,
        "deletedCount": 2,
        "remainingCount": 0,
        "evidenceDigest": "sha256:cccccccccccccccccccccccccccccccccccccccccccccccccccccccccccccccc",
        "errorCode": null,
        "transactionId": null,
        "transactionEvidenceDigest": null
      },
      "indexes": {
        "status": "failed",
        "selectedCount": 2,
        "deletedCount": 0,
        "remainingCount": 2,
        "evidenceDigest": "sha256:dddddddddddddddddddddddddddddddddddddddddddddddddddddddddddddddd",
        "errorCode": "INDEX_DELETE_FAILED",
        "transactionId": null,
        "transactionEvidenceDigest": null
      },
      "caches": {
        "status": "deleted",
        "selectedCount": 3,
        "deletedCount": 3,
        "remainingCount": 0,
        "evidenceDigest": "sha256:eeeeeeeeeeeeeeeeeeeeeeeeeeeeeeeeeeeeeeeeeeeeeeeeeeeeeeeeeeeeeeee",
        "errorCode": null,
        "transactionId": null,
        "transactionEvidenceDigest": null
      },
      "objects": {
        "status": "failed",
        "selectedCount": 1,
        "deletedCount": 0,
        "remainingCount": 1,
        "evidenceDigest": "sha256:ffffffffffffffffffffffffffffffffffffffffffffffffffffffffffffffff",
        "errorCode": "OBJECT_DELETE_FAILED",
        "transactionId": null,
        "transactionEvidenceDigest": null
      }
    },
    "deletionCommittedAt": "2026-08-10T00:05:00Z",
    "blockerCodes": [],
    "failureCodes": [
      "INDEX_DELETE_FAILED",
      "OBJECT_DELETE_FAILED"
    ],
    "backup": {
      "policyVersion": "DRP-1.0.0",
      "maximumRetentionDays": 35,
      "backupExpiryDueAt": "2026-08-17T00:05:00Z",
      "physicalDeletionClaim": "none"
    },
    "auditHandoff": {
      "targetOwner": "audit-operations",
      "inputKind": "owner-local-deletion-result",
      "finalReceiptOwner": "audit-operations",
      "ownerResultIsFinalReceipt": false,
      "conformanceReceiptSatisfiesProduction": false
    },
    "canonicalizationProfile": "SCHOLARSENSE-CANONICAL-JSON-1.0.0",
    "runtimeEvidenceClaim": "none"
  }
}
